{
  "page": {
    "seo": {
      "title": "El Departamento de Inteligencia Artificial - Presentación",
      "description": "El Departamento de Inteligencia Artificial - presentación de un referente en docencia e investigación nacional como internacional",
      "ogTitle": "El Departamento de Inteligencia Artificial - Presentación",
      "ogType": "article",
      "image": "/assets/uploads/2023/08/infopresentacion-DIA.svg",
      "modifiedTime": "2026-05-20T12:25:54+00:00",
      "robots": "index, follow, max-image-preview:large, max-snippet:-1, max-video-preview:-1"
    }
  },
  "ecosystem": {
    "backgroundVideo": {
      "mp4": "/assets/uploads/2023/09/circuit_-_27725-1080p.mp4",
      "poster": "/assets/uploads/2024/01/fondo-movil-DIA.jpg",
      "overlay": "rgba(6, 26, 65, 0.56)"
    },
    "heading": {
      "id": "3gmfy",
      "preset": "button-1",
      "titleTag": "h2",
      "title": "Una vista unificada del",
      "subtitleTag": "p",
      "subtitle": "Ecosistema <br>del DIA"
    },
    "labels": [
      {
        "id": "uxiua",
        "preset": "button-1",
        "titleTag": "h2",
        "title": "<strong>INVESTIGACIÓN</strong>",
        "subtitleTag": "p",
        "subtitle": ""
      },
      {
        "id": "mqgcs",
        "preset": "button-1",
        "titleTag": "h2",
        "title": "<strong>EDUCACIÓN</strong>",
        "subtitleTag": "p",
        "subtitle": ""
      },
      {
        "id": "4s2kl",
        "preset": "button-1",
        "titleTag": "h2",
        "title": "<strong>INNOVACIÓN</strong>",
        "subtitleTag": "p",
        "subtitle": ""
      }
    ],
    "diagram": {
      "id": "kn3hg",
      "src": "/assets/uploads/2023/08/infopresentacion-DIA.svg",
      "alt": ""
    },
    "diagramMobile": {
      "id": "bzt3a",
      "src": "/assets/uploads/2023/08/infopresentacion-DIA.svg",
      "alt": ""
    },
    "research": {
      "number": {
        "id": "o1nse",
        "label": "01"
      },
      "text": {
        "id": "bo8xn",
        "preset": "button-1",
        "titleTag": "h2",
        "title": "<strong>INVESTIGACIÓN</strong>",
        "subtitleTag": "p",
        "subtitle": "El DIA destaca, a nivel nacional e internacional, por su productividad y calidad investigadora. Tiene una alta participación en proyectos de investigación financiados con fondos de la Comisión Europea, y coordina varios de ellos. Participa también en proyectos de financiación pública competitiva nacional (Ministerio de Ciencia, Innovación y Universidades, Ministerio de Economía, Industria y Competitividad, Instituto de Salud Carlos III, etc.) y regional (Comunidad de Madrid), y tiene establecidos contratos de investigación con empresas privadas, bien a través de programas de financiación oficial competitiva (CENIT, CIEN, etc.) o bien a través de contratos directos. Asimismo, una búsqueda en Google Scholar Citations para los términos «Universidad Politécnica de Madrid» muestra que 2 de los 10 principales investigadores de la UPM son miembros de DIA, y para el término «fi.upm.es» muestra que 6 de los 10 mejores investigadores de la ETSIINF de la UPM son miembros de DIA."
      }
    },
    "researchMobile": {
      "number": {
        "id": "a9cs9",
        "label": "01"
      },
      "text": {
        "id": "ls4hq",
        "preset": "button-1",
        "titleTag": "h2",
        "title": "<strong>INVESTIGACIÓN</strong>",
        "subtitleTag": "p",
        "subtitle": "El DIA destaca, a nivel nacional e internacional, por su productividad y calidad investigadora. Tiene una alta participación en proyectos de investigación financiados con fondos de la Comisión Europea, y coordina varios de ellos. Participa también en proyectos de financiación pública competitiva nacional (Ministerio de Ciencia, Innovación y Universidades, Ministerio de Economía, Industria y Competitividad, Instituto de Salud Carlos III, etc.) y regional (Comunidad de Madrid), y tiene establecidos contratos de investigación con empresas privadas, bien a través de programas de financiación oficial competitiva (CENIT, CIEN, etc.) o bien a través de contratos directos. Asimismo, una búsqueda en Google Scholar Citations para los términos «Universidad Politécnica de Madrid» muestra que 2 de los 10 principales investigadores de la UPM son miembros de DIA, y para el término «fi.upm.es» muestra que 6 de los 10 mejores investigadores de la ETSIINF de la UPM son miembros de DIA."
      }
    },
    "education": {
      "number": {
        "id": "42hwv",
        "label": "02"
      },
      "text": {
        "id": "p04ka",
        "preset": "button-1",
        "titleTag": "h2",
        "title": "<strong>EDUCACIÓN</strong>",
        "subtitleTag": "p",
        "subtitle": "La actividad docente del DIA cubre todas las etapas formativas, participando en la impartición de todos los títulos de grado y máster de la ETSIINF, con especial presencia en el Grado en Ciencia de Datos e Inteligencia Artificial, el Máster Universitario en Ciencia de Datos, y coordinando e impartiendo toda la docencia correspondiente al Máster Universitario en Inteligencia Artificial y al Doctorado en Inteligencia Artificial. Además, también se participa en la impartición de diversos títulos en otros centros de la UPM: Grado en Ingeniería Biomédica, Máster Universitario en Biología Computacional y Máster Universitario en Neurotecnología."
      }
    },
    "innovation": {
      "number": {
        "id": "fag3a",
        "label": "03"
      },
      "text": {
        "id": "5g8rx",
        "preset": "button-1",
        "titleTag": "h2",
        "title": "<strong>INNOVACIÓN</strong>",
        "subtitleTag": "p",
        "subtitle": "El DIA tiene un papel relevante en el Digital Innovation Hub in Artificial Intelligence and Robotics for sustainable development goals (AIR4S), uno de los 30 Digital Innovations Hub seleccionados por la Comisión Europea como miembro de la European Network of Digital Innovation Hubs in AI, y ha obtenido el <a rel=\"noreferrer noopener\" href=\"https://digital-strategy.ec.europa.eu/en/activities/edihs\" data-type=\"link\" data-id=\"https://digital-strategy.ec.europa.eu/en/activities/edihs\" target=\"_blank\"><mark style=\"background-color:rgba(0, 0, 0, 0)\" class=\"has-inline-color has-ast-global-color-8-color\">sello de excelencia para DIHs Europeos (EDIH)</mark></a>."
      }
    },
    "innovationLogo": {
      "id": "7zy3s",
      "src": "/assets/uploads/2023/11/Logo-innovacion-1.jpg",
      "alt": ""
    },
    "innovationNote": {
      "id": "gj97s",
      "preset": "button-1",
      "titleTag": "h2",
      "title": "",
      "subtitleTag": "p",
      "subtitle": "El DIA participa activamente en los programas formativos en Innovación y Emprendimiento, así como con el <strong><a style=\"color: #ADD8E6;\" rel=\"noopener noreferrer\" href=\"https://montegancedo.upm.es/Transferencia/CAIT\" target=\"_blank\">CAIT</a></strong> con programas centrados en formación predoctoral y postdoctoral de estudiantes y en la creación de start-ups."
    },
    "video": {
      "popupId": "88t7y",
      "embedUrl": "https://www.youtube.com/embed/yyGrb7Zo_is?rel=0&controls=0&modestbranding=1&cc_load_policy=0",
      "title": "YouTube video player",
      "buttonLabel": "Reproducir vídeo de presentación"
    }
  },
  "welcome": {
    "title": "Carta de Bienvenida",
    "columns": [
      {
        "id": "hm37kg9",
        "preset": "button-1",
        "titleTag": "p",
        "title": "<br>Me complace presentarle el Departamento de Inteligencia Artificial (DIA) de la Universidad Politécnica de Madrid (UPM), una entidad con más de 45 años de historia y un referente en docencia e investigación tanto a nivel nacional como internacional. <br><br>Como parte integral de la Escuela Técnica Superior de Ingenieros Informáticos (ETSIInf), el DIA se enorgullece de ser parte de un centro universitario con gran prestigio en la enseñanza de la ingeniería informática superior en Madrid.<br><br>Nuestro compromiso con la educación se refleja en todas las etapas formativas, con una presencia destacada en programas como el Grado en Ciencia de Datos e Inteligencia Artificial, el Máster Universitario en Ciencia de Datos, el Máster Universitario en Inteligencia Artificial y el Doctorado en Inteligencia Artificial, entre otros. <br><br><br><br>"
      },
      {
        "id": "fvxynmm",
        "preset": "button-1",
        "titleTag": "p",
        "title": "<br><br>La experiencia de nuestro profesorado, junto con indicadores como un H-index elevado, demuestra nuestra dedicación y calidad en la enseñanza.<br><br>A nivel de investigación, el DIA se destaca por su productividad y calidad, con una fuerte presencia en proyectos financiados tanto a nivel europeo como nacional y regional, y colaboraciones con empresas privadas. Los resultados son notorios; 2 de los 10 principales investigadores de la UPM son miembros del DIA.<br><br>Le invito a explorar más sobre nuestra labor y las oportunidades que ofrecemos en nuestro sitio web. Estoy segura de que encontrará en nuestro departamento un líder en el campo de la Inteligencia Artificial, comprometido con la excelencia académica e investigadora.<br><br>Cordialmente,<br><strong>Director del DIA</strong><br><br>"
      }
    ]
  },
  "management": {
    "heading": {
      "id": "eti9iqo",
      "preset": "button-1",
      "titleTag": "h2",
      "title": "Equipo directivo"
    },
    "members": [
      {
        "person": "ocorcho",
        "column": "0hvhglk",
        "id": "8pt3cru",
        "nameHtml": "Óscar Corcho <br> García",
        "role": "Director",
        "email": "director.dia@fi.upm.es",
        "phone": "+34-91-067-2894",
        "office": "2209"
      },
      {
        "person": "damiano",
        "column": "vo2fzb7",
        "id": "54sy9tt",
        "nameHtml": "Damiano <br>Zanardini",
        "role": "Subdirector",
        "email": "subdirector.dia@fi.upm.es",
        "phone": "+34-91-067-2909",